{
  "schema_version": "evaluation-dataset.v1",
  "dataset_id": "riverside-operational-scenarios",
  "version": "2026-08-05",
  "domain": "operational_slos",
  "evaluator_contract_version": "1.0.0",
  "created_at": "2026-08-05T12:00:00Z",
  "source_digest": "ffffffffffffffffffffffffffffffffffffffffffffffffffffffffffffffff",
  "cases": [
    {
      "case_id": "ops-readiness-001",
      "slice": { "name": "load_stage", "value": "warmup" },
      "scenario": "artifact verification and warm-up complete before readiness",
      "load_stage": "warmup",
      "observation_window_seconds": 300,
      "expected_outcome": "no traffic accepted before readiness"
    },
    {
      "case_id": "ops-bounded-load-001",
      "slice": { "name": "load_stage", "value": "bounded" },
      "scenario": "measure TTFT, TPOT, latency, throughput, availability, deadlines, and rejections",
      "load_stage": "bounded",
      "observation_window_seconds": 1800,
      "expected_outcome": "all operational thresholds clear"
    },
    {
      "case_id": "ops-overload-recovery-001",
      "slice": { "name": "load_stage", "value": "overload_recovery" },
      "scenario": "overload, bounded rejection, graceful drain, and rollback",
      "load_stage": "overload_recovery",
      "observation_window_seconds": 900,
      "expected_outcome": "service recovers within the gate window without partial output"
    }
  ]
}
