{
  "schema_version": "evaluation-dataset.v1",
  "dataset_id": "riverside-data-quality",
  "version": "2026-08-05",
  "domain": "data_quality",
  "evaluator_contract_version": "1.0.0",
  "created_at": "2026-08-05T12:00:00Z",
  "source_digest": "aaaaaaaaaaaaaaaaaaaaaaaaaaaaaaaaaaaaaaaaaaaaaaaaaaaaaaaaaaaaaaaa",
  "cases": [
    {
      "case_id": "data-text-complete-001",
      "slice": { "name": "format", "value": "text" },
      "record_id": "doc-001",
      "required_fields": ["tenant_id", "document_id", "content_hash", "acl", "classification", "pipeline_version"],
      "present_fields": ["tenant_id", "document_id", "content_hash", "acl", "classification", "pipeline_version"],
      "parse_succeeded": true,
      "quarantined": false
    }
  ]
}
